<?xml version="1.0" encoding="utf-8" ?> 

<PatternSet
    name="LinkbaseVOs"
    xmlns:xsi="http://www.w3.org/2001/XMLSchema-instance"
    xsi:noNamespaceSchemaLocation="VOPatterns.xsd">

    <Pattern name="Load Namespace Resolvers" detectionType="Discovery" method="runOnce" value="N/A">
        <Failure />
        <Action method="AddToNamespaceResolver" uri="N/A">
            <Selector type="Prefix" method="Constant" value="link" />
            <Selector type="Namespace" method="Constant" value="http://www.xbrl.org/2003/linkbase" />
        </Action>
        <Action method="AddToNamespaceResolver" uri="N/A">
	        <Selector type="Prefix" method="Constant" value="xlink" />
	        <Selector type="Namespace" method="Constant" value="http://www.w3.org/1999/xlink" />
    	</Action>
        <Action method="AddToNamespaceResolver" uri="N/A">
            <Selector type="Prefix" method="Constant" value="xs" />
            <Selector type="Namespace" method="Constant" value="http://www.w3.org/2001/XMLSchema" />
    	</Action>
        <Action method="AddToNamespaceResolver" uri="N/A">
            <Selector type="Prefix" method="Constant" value="xbrli" />
            <Selector type="Namespace" method="Constant" value="http://www.xbrl.org/2003/instance" />
        </Action>
    </Pattern>

    <Pattern name="Discover schemas via 'schemaLocation'" detectionType="Discovery" method="XPath" value="/link:linkbase/@xsi:schemaLocation">
        <Failure />
        <Action method="LoadSchemasFromSchemaLocation" uri="N/A" >
            <Selector type="SchemaLocationPairs" method="XPath" value="." />
            <Failure>
                <Action saveDO="memo" method="CreateWarningMemo" uri="memo://ubmatrix.com/Load/Taxonomy#UnableToLocateOneOrMoreOfTheXsiSchemaLocationFiles"/>
            </Failure>
        </Action>
    </Pattern>

    <!-- Removed this unused relationship for performance
    <Pattern name="Load schemas via 'schemaLocation'" detectionType="Load" method="XPath" value="//@xsi:schemaLocation">
        <Action method="CreateRelationship" uri="relationship://ubmatrix.com/Xbrl/Relationship#SchemaReference">
            <Selector type="From" method="DomainObject" value="instance" />
            <Selector type="To" method="ReferencedDomainObject" value="N/A" />
        </Action>
    </Pattern>
    -->   

   <Pattern name="Find Implicit References" detectionType="Discovery" method="ProcessImplicitReferences" value="xlink:href">
        <Failure />
		<Action method="LoadSchemaFromXmlBase" uri="N/A">
       		<Selector type="LogicalUri" method="AttributeValueWithTruncating" value="xlink:href"/>
       		<Selector type="XmlBase" method="AttributeAncesterOrSelf" value="xml:base" />
       		<Failure>
            <Action method="LoadSchemaFromLogicalUri" uri="N/A">
   	     	     <Selector type="LogicalUri" method="AttributeValueWithTruncating" value="xlink:href"/>
    	         <Failure>
                     	<Action saveDO="memo" method="CreateErrorMemo" uri="memo://ubmatrix.com/Load/Taxonomy#ImplicitSchemaReferenceFailedWithXmlBase">
                           	<Selector type="ValueObject" method="AttributeAncesterOrSelf" value="xml:base" />
                           	<Selector type="ValueObject" method="AttributeValue" value="xlink:href"/>
                           	<Failure>
                              	<Action saveDO="memo" method="CreateErrorMemo" uri="memo://ubmatrix.com/Load/Taxonomy#ImplicitSchemaReferenceFailedLogicalUriOnly">
                                  	<Selector type="ValueObject" method="AttributeValue" value="xlink:href"/>
                                   	<Failure>
                                       	<Action saveDO="memo" method="CreateErrorMemo" uri="memo://ubmatrix.com/Load/Taxonomy#ImplicitSchemaReferenceFailedConfused"/>
                                   	</Failure>
                               	</Action>
                            </Failure>
                        </Action>
                     </Failure>
                </Action>
            </Failure>
         </Action>
    </Pattern>

    <Pattern name="Discover external linkbase" detectionType="Discovery" method="XPath"
             value="/link:linkbase">
        <Failure />
        <Action saveDO="linkbase" method="CreateDomainObject" uri="domain://ubmatrix.com/Xbrl/Linkbase#ExternalLinkbase">
            <Selector type="ValueObject" method="XPath" value="."/>
        </Action>
        <Action method="SetPrimaryDomainObject" uri="N/A">
            <Selector type="From" method="DomainObject" value="linkbase" />
        </Action>
    </Pattern>

    <Pattern name="Discover internal linkbase" detectionType="Discovery" method="XPath"
             value="/xs:schema/xs:annotation/xs:appinfo/link:linkbase">
        <Failure />
        <Action saveDO="linkbase" method="CreateDomainObject" uri="domain://ubmatrix.com/Xbrl/Linkbase#InternalLinkbase">
            <Selector type="ValueObject" method="XPath" value="."/>
        </Action>
    </Pattern>

    <Pattern name="Load linkbase" detectionType="FinalLoad" method="XPath"
             value="/link:linkbase | /xs:schema/xs:annotation/xs:appinfo/link:linkbase">
        
        <Failure />

        <Pattern name="Find link" detectionType="FinalLoad"  method="XPath" value="*[@xlink:type=&quot;extended&quot;]">
            <Failure />

            <Action method="QuickLink" uri="N/A">
                <Selector type="ValueObject" method="XPath" value="."/>
                <Selector type="Linkbase" method="DomainObjectFromValueObjectXPath" value=".."/>
            </Action>

        </Pattern>

    </Pattern>

    <!-- Footnote Linkbases don't have a VO (and don't need pre-discovery -->
    <Pattern name="Load Footnote Linkbase" detectionType="FinalLoad" method="XPath"
             value="/xbrli:xbrl[link:footnoteLink]">
        
        <Failure />

        <Action saveDO="linkbase" method="CreateDomainObject" uri="domain://ubmatrix.com/Xbrl/Linkbase#InternalFootnoteLinkbase" />

        <Action method="CreateRelationship" uri="relationship://ubmatrix.com/Xbrl/Relationship#InstanceReferencesLinkbase">
            <Selector type="From" method="DomainObjectFromValueObjectXPath" value="." />
            <Selector type="To" method="DomainObject" value="linkbase" />
        </Action>
   
        <Pattern name="Find link" detectionType="FinalLoad" method="XPath" value="*[@xlink:type=&quot;extended&quot;]">
            <Failure />

            <Action method="QuickLink" uri="N/A">
                <Selector type="ValueObject" method="XPath" value="."/>
                <Selector type="Linkbase" method="DomainObject" value="linkbase"/>
            </Action>

        </Pattern>

    </Pattern>


    <Pattern name="Find objects classified by role or arcrole" detectionType="FinalLoad" method="XPath" value="/">
        <Action method="ProcessArcroles" uri="N/A">
            <Selector type="ValueObject" method="XPath" value="." />
        </Action>
        <Action method="ProcessRoles" uri="N/A">
            <Selector type="ValueObject" method="XPath" value="." />
        </Action>
    </Pattern>

    <Pattern name="Create namespaces" detectionType="FinalLoad" method="XPath"
             value="/link:linkbase/namespace::node()[name()!= '']">
        <Failure />

        <Action method="AddToNamespaceLookup" uri="N/A">
            <Selector type="Prefix" method="NamespaceNode" value="name" />
            <Selector type="Namespace" method="NamespaceNode" value="value" />
        </Action>

        <Action saveDO="namespace" method="CreateDomainObject" uri="domain://ubmatrix.com/Xbrl/Namespace#Namespace">
            <Selector type="ValueObject" method="XPath" value="."/>
        </Action>

        <Action saveDO="prefix" method="CreateDomainObject" uri="domain://ubmatrix.com/Xbrl/Namespace#NamespacePrefix">
            <Selector type="ValueObject" method="XPath" value="."/>
        </Action>

        <Action saveDO="trn" method="CreateRelationship" uri="relationship://ubmatrix.com/Xbrl/Linkbase/Relationship#LinkbaseReferencesNamespace">
            <Selector type="From" method="DomainObject" value="linkbase" />
            <Selector type="To" method="DomainObject" value="namespace" />
        </Action>

        <Action method="CreateRelationship" uri="relationship://ubmatrix.com/Xbrl/Linkbase/Relationship#LinkbaseNamespaceHasPrefix">
            <Selector type="From" method="DomainObject" value="trn" />
            <Selector type="To" method="DomainObject" value="prefix" />
        </Action>
    </Pattern>


</PatternSet>

<!--
 The contents of this file are subject to the UBmatrix License Version 1.0 (the "License");
 you may not use this file except in compliance with the License. You may obtain a copy of the
 License at http://www.ubmatrix.com/prospect/eula_processor.asp

 Software distributed under the License is distributed on an "AS IS" basis,
 WITHOUT WARRANTY OF ANY KIND, either express or implied.
 See the License for the specific language governing rights and limitations under the License.

 Copyright (c) UBmatrix, Inc., 2005-2006.  All Rights Reserved.
-->
