<?xml version="1.0" encoding="utf-8" ?> 

<PatternSet
    name="TaxonomyVOs"
    xmlns:xsi="http://www.w3.org/2001/XMLSchema-instance"
    xsi:noNamespaceSchemaLocation="VOPatterns.xsd">

    <Pattern name="Load Namespace Resolvers" detectionType="Discovery" method="runOnce" value="N/A">
        <Failure>
                <Action method="ThrowException" uri="memo://ubmatrix.com/Load/Taxonomy#Internal-NamespaceResolverFailure" />
        </Failure>
        <Action method="AddToNamespaceResolver" uri="N/A">
            <Selector type="Prefix" method="Constant" value="xs" />
            <Selector type="Namespace" method="Constant" value="http://www.w3.org/2001/XMLSchema" />
        </Action>
        <Action method="AddToNamespaceResolver" uri="N/A">
            <Selector type="Prefix" method="Constant" value="link" />
            <Selector type="Namespace" method="Constant" value="http://www.xbrl.org/2003/linkbase" />
        </Action>
        <Action method="AddToNamespaceResolver" uri="N/A">
            <Selector type="Prefix" method="Constant" value="xsi" />
            <Selector type="Namespace" method="Constant" value="http://www.w3.org/2001/XMLSchema-instance" />
        </Action>
        <Action method="AddToNamespaceResolver" uri="N/A">
            <Selector type="Prefix" method="Constant" value="xlink" />
            <Selector type="Namespace" method="Constant" value="http://www.w3.org/1999/xlink" />
        </Action>
        <Action method="AddToNamespaceResolver" uri="N/A">
	    <Selector type="Prefix" method="Constant" value="xbrli" />
	    <Selector type="Namespace" method="Constant" value="http://www.xbrl.org/2003/instance" />
	</Action>
    </Pattern>

    <Pattern name="Peek Taxonomy" detectionType="Discovery" method="XPath" value="/xs:schema">
        <Action method="IsTaxonomy" uri="N/A">
        	<Failure>
                    <Action saveDO="memo" method="CreateWarningMemo" uri="memo://ubmatrix.com/Peek/Peek#DifferentFromExpectType">
		            <Selector type="FileType" method="ActualFileType" value="."/>
                            <Selector type="FileType" method="Constant" value="Taxonomy"/>
                    </Action>
          	</Failure>
        </Action>
    </Pattern>

    <Pattern name="Peek Linkbase" detectionType="Discovery" method="XPath" value="/link:linkbase">
        <Action method="IsLinkbase" uri="N/A">
        	<Failure>
                    <Action saveDO="memo" method="CreateWarningMemo" uri="memo://ubmatrix.com/Peek/Peek#DifferentFromExpectType">
		            <Selector type="FileType" method="ActualFileType" value="."/>
                            <Selector type="FileType" method="Constant" value="Linkbase"/>
                    </Action>
          	</Failure>
        </Action>
    </Pattern>

    <Pattern name="Peek Instance" detectionType="Discovery" method="XPath" value="/xbrli:xbrl">
        <Action method="IsInstance" uri="N/A">
        	<Failure>
                    <Action saveDO="memo" method="CreateWarningMemo" uri="memo://ubmatrix.com/Peek/Peek#DifferentFromExpectType">
		            <Selector type="FileType" method="ActualFileType" value="."/>
                            <Selector type="FileType" method="Constant" value="Instance"/>
                    </Action>
          	</Failure>
        </Action>
    </Pattern>
</PatternSet>

<!--
 The contents of this file are subject to the UBmatrix License Version 1.0 (the "License");
 you may not use this file except in compliance with the License. You may obtain a copy of the
 License at http://www.ubmatrix.com/prospect/eula_processor.asp

 Software distributed under the License is distributed on an "AS IS" basis,
 WITHOUT WARRANTY OF ANY KIND, either express or implied.
 See the License for the specific language governing rights and limitations under the License.

 Copyright (c) UBmatrix, Inc., 2005-2006.  All Rights Reserved.
-->